{
  "source_file": "bdd/features/calculator.feature",
  "feature": {
    "name": "Calculator",
    "description": null,
    "tags": [],
    "background": null,
    "scenarios": [
      {
        "type": "Scenario Outline",
        "name": "Add two numbers",
        "tags": [],
        "line": 3,
        "steps": [
          {
            "keyword": "Given",
            "effective_keyword": "Given",
            "text": "first number is <a>",
            "line": 4,
            "status": "PARSED",
            "resolution": {
              "status": "RESOLVED_GENERATED",
              "keyword_name": "Set First Number",
              "source_file": "robot/resources/keywords/generated/calculator_keywords.resource",
              "arguments": [
                "${A}"
              ],
              "argument_pattern": "first_number"
            }
          },
          {
            "keyword": "And",
            "effective_keyword": "Given",
            "text": "second number is <b>",
            "line": 5,
            "status": "PARSED",
            "resolution": {
              "status": "RESOLVED_GENERATED",
              "keyword_name": "Set Second Number",
              "source_file": "robot/resources/keywords/generated/calculator_keywords.resource",
              "arguments": [
                "${B}"
              ],
              "argument_pattern": "second_number"
            }
          },
          {
            "keyword": "When",
            "effective_keyword": "When",
            "text": "two numbers are added",
            "line": 6,
            "status": "PARSED",
            "resolution": {
              "status": "RESOLVED_GENERATED",
              "keyword_name": "Add Two Numbers",
              "source_file": "robot/resources/keywords/generated/calculator_keywords.resource",
              "arguments": [],
              "argument_pattern": ""
            }
          },
          {
            "keyword": "Then",
            "effective_keyword": "Then",
            "text": "result should be <x>",
            "line": 7,
            "status": "PARSED",
            "resolution": {
              "status": "RESOLVED_GENERATED",
              "keyword_name": "Verify Result Equals",
              "source_file": "robot/resources/keywords/generated/calculator_keywords.resource",
              "arguments": [
                "${X}"
              ],
              "argument_pattern": "expected_result"
            }
          }
        ],
        "examples": [
          {
            "headers": [
              "a",
              "b",
              "x"
            ],
            "rows": [
              [
                "10",
                "9",
                "19"
              ],
              [
                "-10",
                "4",
                "-6"
              ],
              [
                "15",
                "-7",
                "8"
              ]
            ]
          }
        ]
      }
    ]
  },
  "resource_imports": [
    "robot/resources/keywords/generated/calculator_keywords.resource"
  ],
  "library_imports": [],
  "unresolved_count": 0,
  "parse_errors": [],
  "warnings": []
}
